{
    "attestation_version": 1,
    "app": "com.example.app",
    "version_code": 30405,
    "map_sha256": "991b91841128bc28322ed485ad3fa9b4b69ec397ff39809e109170738cd000c5",
    "reproduced": true,
    "signatures_sha256": "0000000000000000000000000000000000000000000000000000000000000000",
    "apk": {
        "sha256": "1111111111111111111111111111111111111111111111111111111111111111",
        "signer_sha256": "2222222222222222222222222222222222222222222222222222222222222222",
        "source": "illustrative"
    },
    "attestations": [
        {
            "attestor": "alice",
            "method": "minisign",
            "public_key": "RWQexamplePublicKey==",
            "signature": "RUTexampleSignature==",
            "signed_at": "2026-06-08",
            "notes": "rebuilt from signatures.yaml"
        },
        {
            "attestor": "bob",
            "method": "ssh-ed25519",
            "signature": "ssh-ed25519-detached-sig",
            "signed_at": "2026-06-09"
        }
    ]
}
