{
    "attestation_version": 1,
    "app": "com.example.app",
    "version_code": 100,
    "map_sha256": "aaaaaaaaaaaaaaaaaaaaaaaaaaaaaaaaaaaaaaaaaaaaaaaaaaaaaaaaaaaaaaaa",
    "reproduced": true,
    "attestations": [
        {
            "attestor": "carol",
            "method": "gpg",
            "signature": "gpg-detached-sig",
            "signed_at": "2026-06-08"
        }
    ]
}
