{
    "attestation_version": 1,
    "app": "com.example.app",
    "version_code": 30405,
    "map_sha256": "cbe063f340919e805c7b13c0f1d8b41990ffe2b90cf02d004328b417becd3d04",
    "reproduced": true,
    "signatures_sha256": "0000000000000000000000000000000000000000000000000000000000000000",
    "apk": {
        "sha256": "1111111111111111111111111111111111111111111111111111111111111111",
        "signer_sha256": "2222222222222222222222222222222222222222222222222222222222222222",
        "source": "illustrative worked example \u2014 no real APK is fetched or hosted (Hard rule 3)"
    },
    "attestations": [
        {
            "attestor": "example-maintainer",
            "method": "minisign",
            "public_key": "RWQexamplePublicKeyBase64ForTheWorkedExampleOnly==",
            "signature": "RUTexampleDetachedSignatureOverTheMapDigestBase64ForTheWorkedExampleOnly==",
            "signed_at": "2026-06-08",
            "notes": "Illustrative attestation for the worked-example map; the signature is a placeholder, not a real minisign output. Copy this file's SHAPE \u2014 recompute map_sha256 over your real map bytes and sign that digest."
        }
    ]
}
